tcpdump -n -i eth0
tcpdump: verbose output suppressed, use -v[v]... for full protocol decode
listening on eth0, link-type EN10MB (Ethernet), snapshot length 262144 bytes
17:33:59.190809 IP 137.184.171.44.22 > 174.88.21.119.59725: Flags [P.], seq 2243299829:2243299937, ack 2150564608, win 478, length 108
17:33:59.190883 IP 137.184.171.44.22 > 174.88.21.119.59725: Flags [P.], seq 108:144, ack 1, win 478, length 36
17:33:59.190929 IP 137.184.171.44.22 > 174.88.21.119.59725: Flags [P.], seq 144:196, ack 1, win 478, length 52
17:33:59.190973 IP 137.184.171.44.22 > 174.88.21.119.59725: Flags [P.], seq 196:264, ack 1, win 478, length 68
17:33:59.191028 IP 137.184.171.44.22 > 174.88.21.119.59725: Flags [P.], seq 264:332, ack 1, win 478, length 68
17:33:59.191070 IP 137.184.171.44.22 > 174.88.21.119.59725: Flags [P.], seq 332:368, ack 1, win 478, length 36
17:33:59.195315 IP 174.88.21.119.59725 > 137.184.171.44.22: Flags [.], ack 368, win 506, length 0
17:33:59.210725 IP 174.88.21.119.59725 > 137.184.171.44.22: Flags [P.], seq 1:37, ack 368, win 506, length 36
17:33:59.210941 IP 137.184.171.44.22 > 174.88.21.119.59725: Flags [P.], seq 368:404, ack 37, win 478, length 36
17:33:59.242171 IP 174.88.21.119.59725 > 137.184.171.44.22: Flags [P.], seq 37:73, ack 404, win 506, length 36
17:33:59.242361 IP 137.184.171.44.22 > 174.88.21.119.59725: Flags [P.], seq 404:440, ack 73, win 478, length 36
17:33:59.274965 IP 174.88.21.119.59725 > 137.184.171.44.22: Flags [P.], seq 73:109, ack 440, win 506, length 36
17:33:59.275145 IP 137.184.171.44.22 > 174.88.21.119.59725: Flags [P.], seq 440:476, ack 109, win 478, length 36
17:33:59.288319 IP 137.184.171.44.22 > 174.88.21.119.59725: Flags [P.], seq 476:1984, ack 109, win 478, length 1508
17:33:59.293448 IP 174.88.21.119.59725 > 137.184.171.44.22: Flags [.], ack 476, win 506, options [nop,nop,sack 1 {1928:1984}], length 0
17:33:59.293448 IP 174.88.21.119.59725 > 137.184.171.44.22: Flags [.], ack 1984, win 511, length 0
17:33:59.307288 IP 174.88.21.119.59725 > 137.184.171.44.22: Flags [P.], seq 109:145, ack 1984, win 511, length 36
17:33:59.307535 IP 137.184.171.44.22 > 174.88.21.119.59725: Flags [P.], seq 1984:2020, ack 145, win 478, length 36
17:33:59.340254 IP 174.88.21.119.59725 > 137.184.171.44.22: Flags [P.], seq 145:181, ack 2020, win 511, length 36
17:33:59.340443 IP 137.184.171.44.22 > 174.88.21.119.59725: Flags [P.], seq 2020:2056, ack 181, win 478, length 36
17:33:59.372312 IP 174.88.21.119.59725 > 137.184.171.44.22: Flags [P.], seq 181:217, ack 2056, win 511, length 36
17:33:59.372530 IP 137.184.171.44.22 > 174.88.21.119.59725: Flags [P.], seq 2056:2092, ack 217, win 478, length 36
^C
22 packets captured
35 packets received by filter
0 packets dropped by kernel
